{
  "$schema": "https://json-schema.org/draft/2020-12/schema",
  "$id": "https://contracts.bairui.ai/v1/control-command.schema.json",
  "title": "ControlCommand",
  "type": "object",
  "additionalProperties": false,
  "required": [
    "schema_version",
    "command_id",
    "idempotency_key",
    "deployment_id",
    "action",
    "target",
    "arguments",
    "expected_observation_version",
    "expires_at",
    "created_at"
  ],
  "properties": {
    "schema_version": {
      "const": "1.0"
    },
    "command_id": {
      "type": "string",
      "pattern": "^[A-Za-z0-9][A-Za-z0-9._:/-]{0,255}$"
    },
    "idempotency_key": {
      "type": "string",
      "pattern": "^[A-Za-z0-9][A-Za-z0-9._:/-]{0,255}$"
    },
    "deployment_id": {
      "type": "string",
      "pattern": "^[A-Za-z0-9][A-Za-z0-9._:/-]{0,255}$"
    },
    "action": {
      "enum": [
        "snapshot.collect",
        "deployment.provision",
        "deployment.start",
        "deployment.stop",
        "deployment.suspend",
        "deployment.resume",
        "deployment.delete",
        "credential.revoke",
        "probe.run",
        "contract.test",
        "smoke.test",
        "upstream.check",
        "config.stage",
        "config.apply",
        "config.apply-user",
        "backup.create",
        "backup.verify",
        "backup.restore",
        "backup.expire",
        "release.stage",
        "release.apply",
        "release.rollback",
        "service.restart"
      ]
    },
    "target": {
      "type": "object",
      "additionalProperties": false,
      "required": [
        "module_id"
      ],
      "properties": {
        "module_id": {
          "type": "string",
          "pattern": "^[A-Za-z0-9][A-Za-z0-9._:/-]{0,255}$"
        },
        "instance_id": {
          "type": "string",
          "pattern": "^[A-Za-z0-9][A-Za-z0-9._:/-]{0,255}$"
        }
      }
    },
    "arguments": {
      "type": "object"
    },
    "approval_id": {
      "type": "string",
      "pattern": "^[A-Za-z0-9][A-Za-z0-9._:/-]{0,255}$"
    },
    "expected_observation_version": {
      "type": "integer",
      "minimum": 0
    },
    "not_before": {
      "type": "string",
      "format": "date-time"
    },
    "expires_at": {
      "type": "string",
      "format": "date-time"
    },
    "created_at": {
      "type": "string",
      "format": "date-time"
    }
  },
  "allOf": [
    {
      "if": {
        "properties": {
          "action": {
            "const": "snapshot.collect"
          }
        },
        "required": [
          "action"
        ]
      },
      "then": {
        "properties": {
          "arguments": {
            "type": "object",
            "additionalProperties": false,
            "required": [],
            "properties": {}
          }
        }
      }
    },
    {
      "if": {
        "properties": {
          "action": {
            "const": "deployment.provision"
          }
        },
        "required": [
          "action"
        ]
      },
      "then": {
        "properties": {
          "arguments": {
            "type": "object",
            "additionalProperties": false,
            "required": [
              "agent_id",
              "workspace_ref",
              "config_revision_id"
            ],
            "properties": {
              "agent_id": {
                "type": "string",
                "pattern": "^[A-Za-z0-9][A-Za-z0-9._:/-]{0,255}$"
              },
              "workspace_ref": {
                "type": "string",
                "pattern": "^[A-Za-z0-9][A-Za-z0-9._:/-]{0,255}$"
              },
              "config_revision_id": {
                "type": "string",
                "pattern": "^[A-Za-z0-9][A-Za-z0-9._:/-]{0,255}$"
              }
            }
          }
        }
      }
    },
    {
      "if": {
        "properties": {
          "action": {
            "const": "deployment.start"
          }
        },
        "required": [
          "action"
        ]
      },
      "then": {
        "properties": {
          "arguments": {
            "type": "object",
            "additionalProperties": false,
            "required": [
              "agent_id"
            ],
            "properties": {
              "agent_id": {
                "type": "string",
                "pattern": "^[A-Za-z0-9][A-Za-z0-9._:/-]{0,255}$"
              }
            }
          }
        }
      }
    },
    {
      "if": {
        "properties": {
          "action": {
            "const": "deployment.stop"
          }
        },
        "required": [
          "action"
        ]
      },
      "then": {
        "properties": {
          "arguments": {
            "type": "object",
            "additionalProperties": false,
            "required": [
              "agent_id"
            ],
            "properties": {
              "agent_id": {
                "type": "string",
                "pattern": "^[A-Za-z0-9][A-Za-z0-9._:/-]{0,255}$"
              }
            }
          }
        }
      }
    },
    {
      "if": {
        "properties": {
          "action": {
            "const": "deployment.suspend"
          }
        },
        "required": [
          "action"
        ]
      },
      "then": {
        "properties": {
          "arguments": {
            "type": "object",
            "additionalProperties": false,
            "required": [
              "agent_id"
            ],
            "properties": {
              "agent_id": {
                "type": "string",
                "pattern": "^[A-Za-z0-9][A-Za-z0-9._:/-]{0,255}$"
              }
            }
          }
        }
      }
    },
    {
      "if": {
        "properties": {
          "action": {
            "const": "deployment.resume"
          }
        },
        "required": [
          "action"
        ]
      },
      "then": {
        "properties": {
          "arguments": {
            "type": "object",
            "additionalProperties": false,
            "required": [
              "agent_id"
            ],
            "properties": {
              "agent_id": {
                "type": "string",
                "pattern": "^[A-Za-z0-9][A-Za-z0-9._:/-]{0,255}$"
              }
            }
          }
        }
      }
    },
    {
      "if": {
        "properties": {
          "action": {
            "const": "deployment.delete"
          }
        },
        "required": [
          "action"
        ]
      },
      "then": {
        "properties": {
          "arguments": {
            "type": "object",
            "additionalProperties": false,
            "required": [
              "agent_id"
            ],
            "properties": {
              "agent_id": {
                "type": "string",
                "pattern": "^[A-Za-z0-9][A-Za-z0-9._:/-]{0,255}$"
              },
              "backup_id": {
                "type": "string",
                "pattern": "^[A-Za-z0-9][A-Za-z0-9._:/-]{0,255}$"
              }
            }
          }
        }
      }
    },
    {
      "if": {
        "properties": {
          "action": {
            "const": "credential.revoke"
          }
        },
        "required": [
          "action"
        ]
      },
      "then": {
        "properties": {
          "arguments": {
            "type": "object",
            "additionalProperties": false,
            "required": [
              "identity_id"
            ],
            "properties": {
              "identity_id": {
                "type": "string",
                "pattern": "^[A-Za-z0-9][A-Za-z0-9._:/-]{0,255}$"
              }
            }
          }
        }
      }
    },
    {
      "if": {
        "properties": {
          "action": {
            "const": "probe.run"
          }
        },
        "required": [
          "action"
        ]
      },
      "then": {
        "properties": {
          "arguments": {
            "type": "object",
            "additionalProperties": false,
            "required": [
              "probe_ids"
            ],
            "properties": {
              "probe_ids": {
                "type": "array",
                "minItems": 1,
                "maxItems": 100,
                "uniqueItems": true,
                "items": {
                  "type": "string",
                  "pattern": "^[A-Za-z0-9][A-Za-z0-9._:/-]{0,255}$"
                }
              },
              "test_run_id": {
                "type": "string",
                "pattern": "^[A-Za-z0-9][A-Za-z0-9._:/-]{0,255}$"
              }
            }
          }
        }
      }
    },
    {
      "if": {
        "properties": {
          "action": {
            "const": "contract.test"
          }
        },
        "required": [
          "action"
        ]
      },
      "then": {
        "properties": {
          "arguments": {
            "type": "object",
            "additionalProperties": false,
            "required": [
              "suite_id"
            ],
            "properties": {
              "suite_id": {
                "type": "string",
                "pattern": "^[A-Za-z0-9][A-Za-z0-9._:/-]{0,255}$"
              },
              "test_run_id": {
                "type": "string",
                "pattern": "^[A-Za-z0-9][A-Za-z0-9._:/-]{0,255}$"
              }
            }
          }
        }
      }
    },
    {
      "if": {
        "properties": {
          "action": {
            "const": "smoke.test"
          }
        },
        "required": [
          "action"
        ]
      },
      "then": {
        "properties": {
          "arguments": {
            "type": "object",
            "additionalProperties": false,
            "required": [
              "suite_id"
            ],
            "properties": {
              "suite_id": {
                "type": "string",
                "pattern": "^[A-Za-z0-9][A-Za-z0-9._:/-]{0,255}$"
              },
              "test_run_id": {
                "type": "string",
                "pattern": "^[A-Za-z0-9][A-Za-z0-9._:/-]{0,255}$"
              }
            }
          }
        }
      }
    },
    {
      "if": {
        "properties": {
          "action": {
            "const": "upstream.check"
          }
        },
        "required": [
          "action"
        ]
      },
      "then": {
        "properties": {
          "arguments": {
            "type": "object",
            "additionalProperties": false,
            "required": [
              "upstream_id"
            ],
            "properties": {
              "upstream_id": {
                "type": "string",
                "pattern": "^[A-Za-z0-9][A-Za-z0-9._:/-]{0,255}$"
              },
              "candidate_id": {
                "type": "string",
                "pattern": "^[A-Za-z0-9][A-Za-z0-9._:/-]{0,255}$"
              },
              "test_run_id": {
                "type": "string",
                "pattern": "^[A-Za-z0-9][A-Za-z0-9._:/-]{0,255}$"
              }
            }
          }
        }
      }
    },
    {
      "if": {
        "properties": {
          "action": {
            "const": "config.stage"
          }
        },
        "required": [
          "action"
        ]
      },
      "then": {
        "properties": {
          "arguments": {
            "type": "object",
            "additionalProperties": false,
            "required": [
              "config_revision_id"
            ],
            "properties": {
              "config_revision_id": {
                "type": "string",
                "pattern": "^[A-Za-z0-9][A-Za-z0-9._:/-]{0,255}$"
              }
            }
          }
        }
      }
    },
    {
      "if": {
        "properties": {
          "action": {
            "const": "config.apply"
          }
        },
        "required": [
          "action"
        ]
      },
      "then": {
        "properties": {
          "arguments": {
            "type": "object",
            "additionalProperties": false,
            "required": [
              "config_revision_id"
            ],
            "properties": {
              "config_revision_id": {
                "type": "string",
                "pattern": "^[A-Za-z0-9][A-Za-z0-9._:/-]{0,255}$"
              }
            }
          }
        }
      }
    },
    {
      "if": {
        "properties": {
          "action": {
            "const": "config.apply-user"
          }
        },
        "required": [
          "action"
        ]
      },
      "then": {
        "properties": {
          "arguments": {
            "type": "object",
            "additionalProperties": false,
            "required": [
              "config_revision_id"
            ],
            "properties": {
              "config_revision_id": {
                "type": "string",
                "pattern": "^[A-Za-z0-9][A-Za-z0-9._:/-]{0,255}$"
              }
            }
          }
        }
      }
    },
    {
      "if": {
        "properties": {
          "action": {
            "const": "backup.create"
          }
        },
        "required": [
          "action"
        ]
      },
      "then": {
        "properties": {
          "arguments": {
            "type": "object",
            "additionalProperties": false,
            "required": [
              "backup_policy_id"
            ],
            "properties": {
              "backup_policy_id": {
                "type": "string",
                "pattern": "^[A-Za-z0-9][A-Za-z0-9._:/-]{0,255}$"
              },
              "backup_id": {
                "type": "string",
                "pattern": "^[A-Za-z0-9][A-Za-z0-9._:/-]{0,255}$"
              }
            }
          }
        }
      }
    },
    {
      "if": {
        "properties": {
          "action": {
            "const": "backup.verify"
          }
        },
        "required": [
          "action"
        ]
      },
      "then": {
        "properties": {
          "arguments": {
            "type": "object",
            "additionalProperties": false,
            "required": [
              "backup_id"
            ],
            "properties": {
              "backup_id": {
                "type": "string",
                "pattern": "^[A-Za-z0-9][A-Za-z0-9._:/-]{0,255}$"
              }
            }
          }
        }
      }
    },
    {
      "if": {
        "properties": {
          "action": {
            "const": "backup.restore"
          }
        },
        "required": [
          "action"
        ]
      },
      "then": {
        "properties": {
          "arguments": {
            "type": "object",
            "additionalProperties": false,
            "required": [
              "backup_id",
              "restore_id"
            ],
            "properties": {
              "backup_id": {
                "type": "string",
                "pattern": "^[A-Za-z0-9][A-Za-z0-9._:/-]{0,255}$"
              },
              "restore_id": {
                "type": "string",
                "pattern": "^[A-Za-z0-9][A-Za-z0-9._:/-]{0,255}$"
              }
            }
          }
        }
      }
    },
    {
      "if": {
        "properties": {
          "action": {
            "const": "backup.expire"
          }
        },
        "required": [
          "action"
        ]
      },
      "then": {
        "properties": {
          "arguments": {
            "type": "object",
            "additionalProperties": false,
            "required": [
              "backup_id"
            ],
            "properties": {
              "backup_id": {
                "type": "string",
                "pattern": "^[A-Za-z0-9][A-Za-z0-9._:/-]{0,255}$"
              }
            }
          }
        }
      }
    },
    {
      "if": {
        "properties": {
          "action": {
            "const": "release.stage"
          }
        },
        "required": [
          "action"
        ]
      },
      "then": {
        "properties": {
          "arguments": {
            "type": "object",
            "additionalProperties": false,
            "required": [
              "release_id"
            ],
            "properties": {
              "release_id": {
                "type": "string",
                "pattern": "^[A-Za-z0-9][A-Za-z0-9._:/-]{0,255}$"
              },
              "rollout_id": {
                "type": "string",
                "pattern": "^[A-Za-z0-9][A-Za-z0-9._:/-]{0,255}$"
              }
            }
          }
        }
      }
    },
    {
      "if": {
        "properties": {
          "action": {
            "const": "release.apply"
          }
        },
        "required": [
          "action"
        ]
      },
      "then": {
        "properties": {
          "arguments": {
            "type": "object",
            "additionalProperties": false,
            "required": [
              "release_id"
            ],
            "properties": {
              "release_id": {
                "type": "string",
                "pattern": "^[A-Za-z0-9][A-Za-z0-9._:/-]{0,255}$"
              },
              "rollout_id": {
                "type": "string",
                "pattern": "^[A-Za-z0-9][A-Za-z0-9._:/-]{0,255}$"
              }
            }
          }
        }
      }
    },
    {
      "if": {
        "properties": {
          "action": {
            "const": "release.rollback"
          }
        },
        "required": [
          "action"
        ]
      },
      "then": {
        "properties": {
          "arguments": {
            "type": "object",
            "additionalProperties": false,
            "required": [
              "release_id",
              "rollback_release_id"
            ],
            "properties": {
              "release_id": {
                "type": "string",
                "pattern": "^[A-Za-z0-9][A-Za-z0-9._:/-]{0,255}$"
              },
              "rollback_release_id": {
                "type": "string",
                "pattern": "^[A-Za-z0-9][A-Za-z0-9._:/-]{0,255}$"
              },
              "rollout_id": {
                "type": "string",
                "pattern": "^[A-Za-z0-9][A-Za-z0-9._:/-]{0,255}$"
              }
            }
          }
        }
      }
    },
    {
      "if": {
        "properties": {
          "action": {
            "const": "service.restart"
          }
        },
        "required": [
          "action"
        ]
      },
      "then": {
        "properties": {
          "arguments": {
            "type": "object",
            "additionalProperties": false,
            "required": [
              "service_id"
            ],
            "properties": {
              "service_id": {
                "type": "string",
                "pattern": "^[A-Za-z0-9][A-Za-z0-9._:/-]{0,255}$"
              }
            }
          }
        }
      }
    },
    {
      "if": {
        "properties": {
          "action": {
            "enum": [
              "config.apply",
              "backup.restore",
              "release.apply",
              "release.rollback",
              "service.restart",
              "deployment.delete",
              "credential.revoke"
            ]
          }
        },
        "required": [
          "action"
        ]
      },
      "then": {
        "required": [
          "approval_id"
        ],
        "properties": {
          "approval_id": {
            "type": "string",
            "pattern": "^[A-Za-z0-9][A-Za-z0-9._:/-]{0,255}$"
          }
        }
      }
    }
  ]
}
