{
  "schema_version": "1.0",
  "command_id": "command_legacy_1",
  "idempotency_key": "idem_legacy_1",
  "deployment_id": "deployment_1",
  "action": "deployment.start",
  "target": {
    "module_id": "control-supervisor"
  },
  "arguments": {
    "agent_id": "agent_1"
  },
  "expected_observation_version": 0,
  "created_at": "2026-07-18T00:07:00Z",
  "expires_at": "2026-07-18T00:08:00Z"
}
